{
  "id": "Q-0031",
  "behavior_id": null,
  "prompt": "Should viewer role be able to export records? No spec, test, or behavior covers it.",
  "why_asked": "gap: PR #412 adds /export endpoint; no behavior matches src/records/export.ts",
  "status": "answered",
  "answer": { "by": "ana", "at": "2026-06-10T10:15:00Z", "text": "No — export is admin+editor only." },
  "resulting_mutations": ["BHV-0291 created", "BHV-0291 confirmed"]
}
